[
  {
    "observation_id": "obs-2026-0623-001",
    "observed_date": "2026-06-23",
    "ingested_date": "2026-06-28",
    "source": {
      "name": "The Hacker News",
      "url": "https://thehackernews.com/2026/06/chrome-v8-zero-day-cve-2026-11645.html",
      "type": "news"
    },
    "actor_group": null,
    "actor_aliases": [],
    "techniques": [
      {
        "technique_id": "T1190",
        "sub_technique_id": null,
        "tactic": "initial-access",
        "evidence": "細工したHTMLページを閲覧させるだけでV8の境界外読み書きを起点にサンドボックス内で任意コードを実行する実悪用が確認されている。"
      }
    ],
    "target": {
      "sectors": ["government", "other"],
      "geos": ["US"]
    },
    "cve": ["CVE-2026-11645"],
    "confidence": "high",
    "summary": "Google Chrome/Chromium の V8 エンジンに境界外読み書き脆弱性 CVE-2026-11645（CVSS 8.8）が存在し、CISA KEV 登録済みで実悪用が確認され、2026-06-23 に FCEB 適用期限が到来した。",
    "verified_outcome": null,
    "related_forecast_id": null,
    "tags": ["zero-day", "kev", "browser"]
  },
  {
    "observation_id": "obs-2026-0623-002",
    "observed_date": "2026-06-23",
    "ingested_date": "2026-06-28",
    "source": {
      "name": "Security NEXT",
      "url": "https://www.security-next.com/",
      "type": "news"
    },
    "actor_group": null,
    "actor_aliases": [],
    "techniques": [],
    "target": {
      "sectors": ["manufacturing", "it", "other"],
      "geos": ["JP"]
    },
    "cve": ["CVE-2026-7273"],
    "confidence": "medium",
    "summary": "Zyxel GS1900 シリーズスイッチの CGI にスタックベースバッファオーバーフロー CVE-2026-7273（CVSS 8.8）が存在し、同一 LAN 上の未認証攻撃者が細工 HTTP リクエストで OS コマンドを実行できる。パッチ提供済み・実悪用未確認。",
    "verified_outcome": null,
    "related_forecast_id": null,
    "tags": ["network-device"]
  },
  {
    "observation_id": "obs-2026-0623-003",
    "observed_date": "2026-06-23",
    "ingested_date": "2026-06-28",
    "source": {
      "name": "Security NEXT",
      "url": "https://www.security-next.com/",
      "type": "news"
    },
    "actor_group": null,
    "actor_aliases": [],
    "techniques": [],
    "target": {
      "sectors": ["manufacturing", "defense", "other"],
      "geos": ["JP"]
    },
    "cve": ["CVE-2026-0533", "CVE-2026-0534", "CVE-2026-0535"],
    "confidence": "medium",
    "summary": "Autodesk Fusion のデザインデータ（名称・部品属性・コンポーネント説明）に 3 件の Stored XSS（CVE-2026-0533〜0535）が存在し、被害者の UI 操作によりローカルファイル読み取りやプロセスコンテキストでの任意コード実行が発生し得る。パッチ提供済み・実悪用未確認。",
    "verified_outcome": null,
    "related_forecast_id": null,
    "tags": ["xss"]
  },
  {
    "observation_id": "obs-2026-0623-004",
    "observed_date": "2026-06-22",
    "ingested_date": "2026-06-28",
    "source": {
      "name": "JFrog Blog",
      "url": "https://jfrog.com/blog/pixelsmash-critical-ffmpeg-vulnerability-turns-media-files-into-weapons/",
      "type": "vendor_report"
    },
    "actor_group": null,
    "actor_aliases": [],
    "techniques": [],
    "target": {
      "sectors": ["it", "other"],
      "geos": []
    },
    "cve": ["CVE-2026-8461"],
    "confidence": "high",
    "summary": "FFmpeg の MagicYUV デコーダにヒープ境界外書き込み CVE-2026-8461（PixelSmash、CVSS 8.8）が存在し、JFrog が 50KB の細工メディアファイル 1 本で Jellyfin 10.11.9・Nextcloud に対する RCE を実証した。PoC 公開済み・実悪用未確認・KEV 未登録。",
    "verified_outcome": null,
    "related_forecast_id": null,
    "tags": ["poc", "rce"]
  },
  {
    "observation_id": "obs-2026-0623-005",
    "observed_date": "2026-06-22",
    "ingested_date": "2026-06-28",
    "source": {
      "name": "The Hacker News",
      "url": "https://thehackernews.com/2026/06/29-year-old-squid-proxy-bug-squidbleed.html",
      "type": "news"
    },
    "actor_group": null,
    "actor_aliases": [],
    "techniques": [],
    "target": {
      "sectors": ["education", "it", "other"],
      "geos": []
    },
    "cve": ["CVE-2026-47729"],
    "confidence": "medium",
    "summary": "Squid Proxy の FTP ゲートウェイにヒープ越境読み取り CVE-2026-47729（Squidbleed）が存在し、信頼クライアントが攻撃者制御の FTP サーバーへのリスティング処理を経由して他ユーザーの Authorization ヘッダー・Cookie・セッショントークンを含むヒープ内容をリークできる。パッチ未提供（7.7 予定）・実悪用未確認。",
    "verified_outcome": null,
    "related_forecast_id": null,
    "tags": ["info-leak"]
  },
  {
    "observation_id": "obs-2026-0623-006",
    "observed_date": "2026-06-22",
    "ingested_date": "2026-06-28",
    "source": {
      "name": "The Hacker News",
      "url": "https://thehackernews.com/2026/06/shapedplugin-wordpress-pro-plugins.html",
      "type": "news"
    },
    "actor_group": null,
    "actor_aliases": [],
    "techniques": [
      {
        "technique_id": "T1195",
        "sub_technique_id": "T1195.001",
        "tactic": "initial-access",
        "evidence": "ShapedPlugin 社のビルド・配布パイプラインが侵害され、3 つの WordPress 有料プラグインの正規アップデートにバックドアが埋め込まれた。"
      },
      {
        "technique_id": "T1505",
        "sub_technique_id": "T1505.003",
        "tactic": "persistence",
        "evidence": "バックドアが Webシェルのインストールおよび認証済み REST バックドアを設置する機能を持つと Wordfence が分析。"
      }
    ],
    "target": {
      "sectors": ["retail", "it", "other"],
      "geos": ["JP"]
    },
    "cve": ["CVE-2026-10735", "CVE-2026-49777"],
    "confidence": "high",
    "summary": "ShapedPlugin 社の EDD 配布インフラが侵害され、3 つの WordPress 有料プラグインにバックドアが挿入された（CVE-2026-49777 CVSS 10.0 / CVE-2026-10735 CVSS 9.8）。ペイロードは C2（194.76.217.28:2871）からスクリプトを取得し、TOTP シード窃取・Webシェル設置・WooCommerce データ窃取を行うアクティブな侵害が確認されている。",
    "verified_outcome": null,
    "related_forecast_id": null,
    "tags": ["supply-chain", "backdoor", "wordpress"]
  },
  {
    "observation_id": "obs-2026-0623-007",
    "observed_date": "2026-06-23",
    "ingested_date": "2026-06-28",
    "source": {
      "name": "Help Net Security",
      "url": "https://www.helpnetsecurity.com/2026/06/05/cisco-sd-wan-cve-2026-20245-0-day-exploited/",
      "type": "news"
    },
    "actor_group": null,
    "actor_aliases": [],
    "techniques": [
      {
        "technique_id": "T1068",
        "sub_technique_id": null,
        "tactic": "privilege-escalation",
        "evidence": "認証済み netadmin 権限から細工ファイルを投入して root 権限コマンドを実行できる実悪用（限定事例）が確認されている。"
      }
    ],
    "target": {
      "sectors": ["it", "critical_infrastructure", "other"],
      "geos": ["US"]
    },
    "cve": ["CVE-2026-20245"],
    "confidence": "high",
    "summary": "Cisco Catalyst SD-WAN Manager に認証済み root 権限昇格 CVE-2026-20245（CVSS 7.8）が存在し、KEV 登録済み・実悪用確認（限定事例）で 2026-06-23 に FCEB 期限が到来した。",
    "verified_outcome": null,
    "related_forecast_id": null,
    "tags": ["kev", "privilege-escalation"]
  },
  {
    "observation_id": "obs-2026-0623-008",
    "observed_date": "2026-06-23",
    "ingested_date": "2026-06-28",
    "source": {
      "name": "The Hacker News",
      "url": "https://thehackernews.com/2026/06/cisa-adds-cisco-chrome-and-arista-flaws.html",
      "type": "news"
    },
    "actor_group": null,
    "actor_aliases": [],
    "techniques": [],
    "target": {
      "sectors": ["finance", "it", "critical_infrastructure"],
      "geos": ["US"]
    },
    "cve": ["CVE-2026-7473"],
    "confidence": "high",
    "summary": "Arista EOS にトンネルパケット転送不備 CVE-2026-7473（CVSS 6.9）が存在し、ネットワーク隔離破壊により到達不能セグメントへのアクセスが可能になる。KEV 登録済み・実悪用確認・2026-06-23 に FCEB 期限が到来した。",
    "verified_outcome": null,
    "related_forecast_id": null,
    "tags": ["kev", "network-device"]
  },
  {
    "observation_id": "obs-2026-0623-009",
    "observed_date": "2026-06-23",
    "ingested_date": "2026-06-28",
    "source": {
      "name": "The Hacker News",
      "url": "https://thehackernews.com/2026/06/hackers-exploit-gravity-smtp-wordpress.html",
      "type": "news"
    },
    "actor_group": null,
    "actor_aliases": [],
    "techniques": [
      {
        "technique_id": "T1190",
        "sub_technique_id": null,
        "tactic": "initial-access",
        "evidence": "REST API の permission_callback が無条件 true を返すため未認証攻撃者が単一 HTTP リクエストで設定データを取得でき、17M 超の攻撃試行が確認されている。"
      }
    ],
    "target": {
      "sectors": ["it", "other"],
      "geos": []
    },
    "cve": ["CVE-2026-4020"],
    "confidence": "medium",
    "summary": "WordPress Gravity SMTP プラグインの REST API に未認証情報漏洩 CVE-2026-4020（CVSS 5.3）が存在し、未認証攻撃者が単一リクエストで Amazon SES・Gmail・Mailjet の API キーや OAuth トークンを含む設定データを取得できる。実悪用確認（17M 超の試行）・パッチ提供済み（v2.1.5）。",
    "verified_outcome": null,
    "related_forecast_id": null,
    "tags": ["wordpress", "info-leak", "credential-theft"]
  },
  {
    "observation_id": "obs-2026-0623-010",
    "observed_date": "2026-06-17",
    "ingested_date": "2026-06-28",
    "source": {
      "name": "Microsoft MSTIC",
      "url": "https://www.microsoft.com/en-us/security/blog/2026/06/17/postinstall-payload-inside-mastra-npm-supply-chain-compromise/",
      "type": "vendor_report"
    },
    "actor_group": "Sapphire Sleet",
    "actor_aliases": ["BlueNoroff", "CryptoCore", "APT38"],
    "techniques": [
      {
        "technique_id": "T1195",
        "sub_technique_id": "T1195.001",
        "tactic": "initial-access",
        "evidence": "postinstall フック経由で npm メンテナーの正規パッケージ 144 件に悪意あるペイロードを挿入するサプライチェーン攻撃。"
      },
      {
        "technique_id": "T1059",
        "sub_technique_id": "T1059.001",
        "tactic": "execution",
        "evidence": "postinstall フックが C2 から PowerShell バックドアをダウンロードし実行する。"
      },
      {
        "technique_id": "T1543",
        "sub_technique_id": "T1543.003",
        "tactic": "persistence",
        "evidence": "scdev サービスを SYSTEM 権限で svchost.exe 配下に登録し永続化する。"
      },
      {
        "technique_id": "T1562",
        "sub_technique_id": "T1562.001",
        "tactic": "defense-evasion",
        "evidence": "Microsoft Defender の除外設定を追加し EDR 検知を回避する。"
      }
    ],
    "target": {
      "sectors": ["it", "professional_services"],
      "geos": []
    },
    "cve": [],
    "confidence": "high",
    "summary": "Sapphire Sleet（北朝鮮 DPRK）が 2026-06-17 に AI フレームワーク Mastra の npm エコシステムを標的にサプライチェーン攻撃を実施し、偽 LinkedIn でメンテナー権限を取得後 144 パッケージに postinstall フック経由の PowerShell バックドアを挿入、scdev サービスで永続化し Defender 除外を追加した。Microsoft MSTIC が高信頼で帰属。",
    "verified_outcome": null,
    "related_forecast_id": null,
    "tags": ["supply-chain", "dprk", "npm"]
  },
  {